{
  "artifacts": {
    "best_csv": {
      "path": "data/analytic/n3_characteristic_recurrence_best.csv",
      "sha256": "6fa553aa5e239d6d05aff03c1bf1679a9418e67faad6b1ff4aedd1b58c74974b"
    },
    "block_csv": {
      "path": "data/analytic/n3_characteristic_recurrence_blocks.csv",
      "sha256": "69d1fe3552779aac4bb79ed001dd316f9b113a7d3630801cdfb70ae94d06cba2"
    },
    "candidate": {
      "file_sha256": "778165afc804c3daa8c3e9a416ffc8d94ac93956b1b905de45c241d3741261c8",
      "path": "certificates/analytic/n3_recurrence_candidate_n12.json",
      "semantic_sha256": "ab8e8a6d0aa24440ceb1379b86d9ae70dd02b2a5b263f4db4ea89eb354f49a24"
    }
  },
  "best_rows": [
    {"crosscheck_abs_error":"4.046935565540888949121691019676545424978956114438769498340695E-17","direct_divisor_vector_phi_abs":"9.999999999999573000000000000000000000000000000000000000000000E-1","max_phase_residual_cycles":"9.306465434894283701488587043124220149773618394225646170276697E-8","n":3,"phi_abs":"9.999999999999572595306443445911105087830898032345457502104389E-1","q":190537,"selected_from_block_index":2,"t":"1.727164608686656053810059650856033088019431936951377678448102E+6"},
    {"crosscheck_abs_error":"4.046935565540888949121691019676545424978956114438769498340695E-17","direct_divisor_vector_phi_abs":"9.999999999999573000000000000000000000000000000000000000000000E-1","max_phase_residual_cycles":"9.306465434894283701488587043124220149773618394225646170276697E-8","n":4,"phi_abs":"9.999999999999572595306443445911105087830898032345457502104389E-1","q":190537,"selected_from_block_index":2,"t":"1.727164608686656053810059650856033088019431936951377678448102E+6"},
    {"crosscheck_abs_error":"3.906923382806620005053021932276882696396181892718369296739792E-17","direct_divisor_vector_phi_abs":"9.999994339686029000000000000000000000000000000000000000000000E-1","max_phase_residual_cycles":"2.472826536787419245681054157287796777692291378396652341410167E-4","n":5,"phi_abs":"9.999994339686029390692338280662000505302193227688269639618189E-1","q":1251764,"selected_from_block_index":3,"t":"1.134689052114835086382957382972415542593593999656761851128605E+7"},
    {"crosscheck_abs_error":"4.260261676925545934828946111496768747660887795937222244111550E-16","direct_divisor_vector_phi_abs":"9.999989310408952000000000000000000000000000000000000000000000E-1","max_phase_residual_cycles":"2.472826536787419245681054157287796777692291378396652341410167E-4","n":6,"phi_abs":"9.999989310408947739738323074454065171053888503231252339112204E-1","q":1251764,"selected_from_block_index":3,"t":"1.134689052114835086382957382972415542593593999656761851128605E+7"},
    {"crosscheck_abs_error":"1.289028776422048319210455354975185957240307396937019494261180E-16","direct_divisor_vector_phi_abs":"9.998129408843455000000000000000000000000000000000000000000000E-1","max_phase_residual_cycles":"3.763099037915599206891847718607758707372774421473840454383649E-3","n":7,"phi_abs":"9.998129408843456289028776422048319210455354975185957240307397E-1","q":103169,"selected_from_block_index":2,"t":"9.351981269443395162909568436532855962772415515271925332497743E+5"},
    {"crosscheck_abs_error":"5.289028776422048319210455354975185957240307396937019494261180E-16","direct_divisor_vector_phi_abs":"9.998129408843451000000000000000000000000000000000000000000000E-1","max_phase_residual_cycles":"3.763099037915599206891847718607758707372774421473840454383649E-3","n":8,"phi_abs":"9.998129408843456289028776422048319210455354975185957240307397E-1","q":103169,"selected_from_block_index":2,"t":"9.351981269443395162909568436532855962772415515271925332497743E+5"},
    {"crosscheck_abs_error":"2.441649849368962923490865890894940000343010943226067395768017E-16","direct_divisor_vector_phi_abs":"9.997421934872929000000000000000000000000000000000000000000000E-1","max_phase_residual_cycles":"5.188465104334473544882916130253070983527489361869490454072191E-3","n":9,"phi_abs":"9.997421934872926558350150631037076509134109105059999656989057E-1","q":1961789,"selected_from_block_index":3,"t":"1.778306854055005743319136499678910812972049187380879443060940E+7"},
    {"crosscheck_abs_error":"4.970037691364150552501416462456182917309278673796228565523299E-16","direct_divisor_vector_phi_abs":"9.995637106203299000000000000000000000000000000000000000000000E-1","max_phase_residual_cycles":"5.188465104334473544882916130253070983527489361869490454072191E-3","n":10,"phi_abs":"9.995637106203294029962308635849447498583537543817082690721326E-1","q":1961789,"selected_from_block_index":3,"t":"1.778306854055005743319136499678910812972049187380879443060940E+7"},
    {"crosscheck_abs_error":"1.215959230677807572743331841979612137358562936533881281785375E-15","direct_divisor_vector_phi_abs":"9.963488288076230000000000000000000000000000000000000000000000E-1","max_phase_residual_cycles":"1.693623219152402084848637854311280552860703109584785182354837E-2","n":11,"phi_abs":"9.963488288076242159592306778075727433318419796121373585629365E-1","q":1161483,"selected_from_block_index":3,"t":"1.052851850921974909517558014167966263335768834623247453301425E+7"},
    {"crosscheck_abs_error":"1.856740859176687785318041511909797558006564477312194252722411E-15","direct_divisor_vector_phi_abs":"9.963479152311586000000000000000000000000000000000000000000000E-1","max_phase_residual_cycles":"1.693623219152402084848637854311280552860703109584785182354837E-2","n":12,"phi_abs":"9.963479152311604567408591766877853180415119097975580065644773E-1","q":1161483,"selected_from_block_index":3,"t":"1.052851850921974909517558014167966263335768834623247453301425E+7"}
  ],
  "generated_evidence_semantic_sha256": "b15ad70a01046ec292ab3197faafc357bf4c9be155e97a5d498b10a6681123fc",
  "result_class": "computational evidence",
  "schema": "nova4.n3-characteristic-recurrence-index.v1",
  "scope": "The full JSON evidence is regenerated deterministically. The committed tables and candidate are computational evidence only.",
  "search": {
    "anchor_prime": 2,
    "blocks": [[1000,9999],[10000,99999],[100000,999999],[1000000,2000000]],
    "direct_crosscheck": "exact exponent-vector enumeration with complex binary64 phase evaluation",
    "finalist_precision_decimal_digits": 80,
    "frequency_parameterization": "t_q = 2*pi*q/log(2)",
    "n_values": [3,4,5,6,7,8,9,10,11,12],
    "q_count": 1999001,
    "q_max": 2000000,
    "q_min": 1000,
    "scan_precision": "IEEE 754 binary64",
    "t_max": "1.812944056730877523851073178286666724068744587089518233674407E+7",
    "t_min": "9.064720283654387619255365891433333620343722935447591168372033E+3",
    "top_k_binary64_finalists_per_n_per_block": 8
  },
  "sha256": "2522c0dd7a76d36e57d5da784fef2e7ada95dccda2d929530ca220d04bf57499",
  "source": {
    "branch": "nova/analytic-density",
    "handoff": "N3-HO-N4-002",
    "handoff_commit": "7469dada02fa4caca08ed391ef8b0cb0f1e855b2",
    "object": "N3-ANA-007",
    "proof_commit": "ff57005b975c4917341306bd0eceb6d05a9b18f6",
    "proof_file": "tracks/nova3-analytic-density/proofs/PRODUCT_MODEL_THEOREMS.md",
    "repository": "Lumathpolgar/erdos18-factorial-program",
    "request": "D"
  },
  "totals": {"block_count":4,"block_winner_count":40,"grid_points_per_n":1999001,"n_count":10,"total_n_q_scores":19990010}
}
